{
    "$schema": "../../lib/schema/link_output.schema.json",
    "version": "1.9.0",
    "timestamp": "2025-02-11 11:20:20.000",
    "dependencies": [
        "/private/var/folders/2y/mngq9h194yzglt4kzttzfq6800klzg/T/0s5bKi/simple_link/assets/data_3.json",
        "/private/var/folders/2y/mngq9h194yzglt4kzttzfq6800klzg/T/0s5bKi/simple_link/assets/data_2.json"
    ],
    "assets": [
        {
            "name": "assets/data_0.json",
            "package": "simple_link",
            "file": "/private/var/folders/2y/mngq9h194yzglt4kzttzfq6800klzg/T/0s5bKi/simple_link/assets/data_0.json",
            "type": "data"
        },
        {
            "name": "assets/data_1.json",
            "package": "simple_link",
            "file": "/private/var/folders/2y/mngq9h194yzglt4kzttzfq6800klzg/T/0s5bKi/simple_link/assets/data_1.json",
            "type": "data"
        }
    ]
}
